{
  "schemaVersion": "1.0.0",
  "destino": "COREIA_DO_SUL",
  "nome": "Coreia do Sul",
  "bandeira": "🇰🇷",
  "lastVerified": "2026-04-19",
  "verifiedBy": "Leonardo Braga de Almeida",
  "nextReviewDate": "2026-07-19",
  "confidence": "MEDIA",
  "sources": [
    {
      "url": "https://www.qia.go.kr/english/html/Animal_livestock/02AnimalLivestock_007-8.jsp",
      "title": "APQA — Importação de pets",
      "type": "OFICIAL",
      "lastAccessed": "2026-04-19"
    }
  ],
  "changeLog": [
    {
      "date": "2026-04-19",
      "author": "Leonardo Braga de Almeida",
      "description": "Criação inicial via levantamento de produto."
    }
  ],
  "rules": {
    "exigeMicrochip": true,
    "exigeVacina": true,
    "diasCarenciaVacina": 30,
    "exigeSorologia": true,
    "diasCarenciaSorologia": 0,
    "exigeCVI": true,
    "diasAntesCVI": 10,
    "exigePermissaoImportacao": false,
    "observacoes": "Sorologia deve ser feita dentro de 24 meses antes do embarque. Sem chip ou sem sorologia (>=0.5 IU/ml): QUARENTENA compulsória por tempo indeterminado."
  }
}
