{
  "schemaVersion": "1.0.0",
  "destino": "CATAR",
  "nome": "Catar",
  "bandeira": "🇶🇦",
  "lastVerified": "2026-04-24",
  "verifiedBy": "iPet Pass (automação)",
  "nextReviewDate": "2026-07-24",
  "confidence": "MEDIA",
  "sources": [
    {
      "url": "https://www.mme.gov.qa/en",
      "title": "MME — Ministry of Municipality and Environment",
      "type": "OFICIAL",
      "lastAccessed": "2026-04-24"
    }
  ],
  "changeLog": [
    {
      "date": "2026-04-24",
      "author": "iPet Pass (automação)",
      "description": "Criação inicial. Mapeamento de regras sanitárias para o Catar."
    }
  ],
  "rules": {
    "exigeMicrochip": true,
    "microchipPadrao": "ISO 11784/11785 (15 dígitos).",
    "exigeVacina": true,
    "diasCarenciaVacina": 30,
    "validadeVacinaAnos": 1,
    "exigeSorologia": true,
    "diasCarenciaSorologia": 90,
    "valorMinimoSorologia": "≥0,5 UI/mL",
    "laboratoriosCredenciados": "Laboratório aprovado pela OIE",
    "exigeCVI": true,
    "diasAntesCVI": 10,
    "emissoresCVI": "Médico veterinário credenciado pelo MAPA. Endosso SFA obrigatório.",
    "exigePermissaoImportacao": true,
    "racasRestritasOuProibidas": ["Afghan Hound", "American Staffordshire Terrier", "Boerboel", "Boston Terrier", "Boxer", "Bull Terrier", "Bulldog", "Mastiff", "Doberman", "Great Dane", "Rottweiler", "Shar-Pei"],
    "observacoes": "A Permissão de Importação é obrigatória e válida por apenas 30 dias após emissão. A sorologia deve ser coletada pelo menos 90 dias antes do embarque. Animais geralmente não podem viajar na cabine nos voos da Qatar Airways, apenas como excesso de bagagem ou carga.",
    "observacoesInternas": "Sincronizar a regra de cabine da Qatar Airways (já mapeada) com este destino."
  }
}
