{
  "schemaVersion": "1.0.0",
  "destino": "SUICA",
  "nome": "Suíça",
  "bandeira": "🇨🇭",
  "lastVerified": "2026-04-19",
  "verifiedBy": "Leonardo Braga de Almeida",
  "nextReviewDate": "2026-07-19",
  "confidence": "MEDIA",
  "sources": [
    {
      "url": "https://www.blv.admin.ch/blv/en/home/tiere/reisen-mit-heimtieren.html",
      "title": "FSVO — Importação de pets",
      "type": "OFICIAL",
      "lastAccessed": "2026-04-19"
    }
  ],
  "changeLog": [
    {
      "date": "2026-04-19",
      "author": "Leonardo Braga de Almeida",
      "description": "Criação inicial via levantamento de produto."
    }
  ],
  "rules": {
    "exigeMicrochip": true,
    "exigeVacina": true,
    "diasCarenciaVacina": 21,
    "exigeSorologia": true,
    "diasCarenciaSorologia": 90,
    "exigeCVI": true,
    "diasAntesCVI": 10,
    "exigePermissaoImportacao": false,
    "observacoes": "NÃO é UE, mas aplica regras harmonizadas. Cães com orelhas cortadas (conchectomia) ou cauda cortada (caudectomia) não podem entrar na Suíça."
  }
}
