{
  "schemaVersion": "1.0.0",
  "destino": "PARAGUAI",
  "nome": "Paraguai",
  "bandeira": "🇵🇾",
  "lastVerified": "2026-04-19",
  "verifiedBy": "Leonardo Braga de Almeida",
  "nextReviewDate": "2026-07-19",
  "confidence": "MEDIA",
  "sources": [
    {
      "url": "https://www.senacsa.gov.py/index.php/tramites/requisitos-de-importacion",
      "title": "SENACSA — Importação de pets",
      "type": "OFICIAL",
      "lastAccessed": "2026-04-19"
    }
  ],
  "changeLog": [
    {
      "date": "2026-04-19",
      "author": "Leonardo Braga de Almeida",
      "description": "Criação inicial via levantamento de produto."
    }
  ],
  "rules": {
    "exigeMicrochip": true,
    "exigeVacina": true,
    "diasCarenciaVacina": 21,
    "exigeSorologia": false,
    "diasCarenciaSorologia": 0,
    "exigeCVI": true,
    "diasAntesCVI": 10,
    "exigePermissaoImportacao": false,
    "observacoes": "NÃO CONFIRMADO exigência de permissão de importação para todos os casos — verificar no site do SENACSA dependendo do país de origem."
  }
}
