{
  "schemaVersion": "1.0.0",
  "destino": "HOLANDA",
  "nome": "Holanda",
  "bandeira": "🇳🇱",
  "lastVerified": "2026-04-19",
  "verifiedBy": "Leonardo Braga de Almeida",
  "nextReviewDate": "2026-07-19",
  "confidence": "MEDIA",
  "sources": [
    {
      "url": "https://english.nvwa.nl/topics/travelling-to-the-netherlands-with-your-dog-or-cat",
      "title": "NVWA — Importação de pets",
      "type": "OFICIAL",
      "lastAccessed": "2026-04-19"
    }
  ],
  "changeLog": [
    {
      "date": "2026-04-19",
      "author": "Leonardo Braga de Almeida",
      "description": "Criação inicial via levantamento de produto."
    }
  ],
  "rules": {
    "exigeMicrochip": true,
    "exigeVacina": true,
    "diasCarenciaVacina": 21,
    "exigeSorologia": true,
    "diasCarenciaSorologia": 90,
    "exigeCVI": true,
    "diasAntesCVI": 10,
    "exigePermissaoImportacao": false,
    "observacoes": "Segue Regulamento EU 576/2013. A entrada de cães e gatos vindos da Rússia ou Bielorrússia sofreu sanções rigorosas recentes (verificar origem no portal NVWA)."
  }
}
