{
  "schemaVersion": "1.0.0",
  "destino": "INDONESIA",
  "nome": "Indonésia",
  "bandeira": "🇮🇩",
  "lastVerified": "2026-07-17",
  "verifiedBy": "Claude (pesquisa web automatizada) — revisão humana pendente: Leonardo Braga de Almeida",
  "nextReviewDate": "2026-10-15",
  "confidence": "ALTA",
  "sources": [
    {
      "url": "https://karantinaindonesia.go.id/",
      "title": "Indonesian Agricultural Quarantine Agency (IAQA)",
      "type": "OFICIAL",
      "lastAccessed": "2026-04-24"
    },
    {
      "url": "https://www.aphis.usda.gov/pet-travel/us-to-another-country-export/pet-travel-us-indonesia",
      "title": "Ministério da Agricultura da Indonésia — referência oficial",
      "type": "OFICIAL",
      "lastAccessed": "2026-07-17"
    }
  ],
  "changeLog": [
    {
      "date": "2026-04-24",
      "author": "iPet Pass (automação)",
      "description": "Criação inicial. Mapeamento de regras sanitárias para Indonésia. Nota: URL da fonte corrigida de karantinabdn.go.kr (domínio .kr da Coreia, provável erro de transcrição) para karantinaindonesia.go.id."
    },
    {
      "date": "2026-07-17",
      "author": "Claude — revisão 2026-07-17",
      "description": "Revisão 17/07/2026: mecânica de permit/inspeção confirmada em pesquisa (Ministério da Agricultura da Indonésia); demais regras mantidas."
    }
  ],
  "rules": {
    "exigeMicrochip": true,
    "microchipPadrao": "ISO 11784/11785 (15 dígitos).",
    "exigeVacina": true,
    "diasCarenciaVacina": 30,
    "validadeVacinaAnos": 1,
    "exigeSorologia": true,
    "diasCarenciaSorologia": 30,
    "valorMinimoSorologia": "≥0,5 UI/mL",
    "laboratoriosCredenciados": "Laboratório aprovado pela OIE",
    "exigeCVI": true,
    "diasAntesCVI": 5,
    "emissoresCVI": "Médico veterinário credenciado pelo MAPA. Endosso SFA obrigatório.",
    "exigePermissaoImportacao": true,
    "racasRestritasOuProibidas": [],
    "observacoes": "ATENÇÃO: É estritamente proibida a entrada de cães e gatos em áreas livres de raiva, como a Ilha de BALI. A entrada deve ser por Jacarta, com quarentena obrigatória de 7 a 14 dias. A Permissão de Importação do Ministério da Agricultura Indonésio é obrigatória e complexa de se obter sem despachante local. Import permit prévio obrigatório; atenção: DKI Jakarta é zona livre de raiva com restrições adicionais de entrada de cães/gatos — confirmar rota/porto de entrada; quarentena possível conforme origem.",
    "observacoesInternas": "Bloquear ou exibir alerta vermelho MASSIVO se o usuário tentar colocar 'Bali' como destino final."
  }
}