{
  "schemaVersion": "1.0.0",
  "destino": "EQUADOR",
  "nome": "Equador",
  "bandeira": "🇪🇨",
  "lastVerified": "2026-04-19",
  "verifiedBy": "Leonardo Braga de Almeida",
  "nextReviewDate": "2026-07-19",
  "confidence": "MEDIA",
  "sources": [
    {
      "url": "https://www.agrocalidad.gob.ec/viajes-con-mascotas/",
      "title": "Agrocalidad — Importação de pets",
      "type": "OFICIAL",
      "lastAccessed": "2026-04-19"
    }
  ],
  "changeLog": [
    {
      "date": "2026-04-19",
      "author": "Leonardo Braga de Almeida",
      "description": "Criação inicial via levantamento de produto."
    }
  ],
  "rules": {
    "exigeMicrochip": true,
    "exigeVacina": true,
    "diasCarenciaVacina": 21,
    "exigeSorologia": false,
    "diasCarenciaSorologia": 0,
    "exigeCVI": true,
    "diasAntesCVI": 10,
    "exigePermissaoImportacao": false,
    "observacoes": "Requer tratamento contra parasitas (internos e externos) realizado nos 21 dias que antecedem o embarque."
  }
}
