{
  "schemaVersion": "1.0.0",
  "destino": "ITALIA",
  "nome": "Itália",
  "bandeira": "🇮🇹",
  "lastVerified": "2026-04-19",
  "verifiedBy": "Leonardo Braga de Almeida",
  "nextReviewDate": "2026-07-19",
  "confidence": "MEDIA",
  "sources": [
    {
      "url": "https://www.salute.gov.it/portale/caniGatti/dettaglioContenutiCaniGatti.jsp?area=cani&id=216",
      "title": "Ministero della Salute — Importação de pets",
      "type": "OFICIAL",
      "lastAccessed": "2026-04-19"
    }
  ],
  "changeLog": [
    {
      "date": "2026-04-19",
      "author": "Leonardo Braga de Almeida",
      "description": "Criação inicial via levantamento de produto."
    }
  ],
  "rules": {
    "exigeMicrochip": true,
    "exigeVacina": true,
    "diasCarenciaVacina": 21,
    "exigeSorologia": true,
    "diasCarenciaSorologia": 90,
    "exigeCVI": true,
    "diasAntesCVI": 10,
    "exigePermissaoImportacao": false,
    "observacoes": "Segue Regulamento EU 576/2013 sem particularidades adicionais de saúde. Sorologia obrigatória para países não listados."
  }
}
