{
  "schemaVersion": "1.0.0",
  "destino": "UNIAO_EUROPEIA",
  "nome": "União Europeia",
  "bandeira": "🇪🇺",
  "lastVerified": "2026-07-17",
  "verifiedBy": "Claude (pesquisa web automatizada) — revisão humana pendente: Leonardo Braga de Almeida",
  "nextReviewDate": "2026-10-15",
  "confidence": "ALTA",
  "sources": [
    {
      "url": "https://ec.europa.eu/food/animals/pet-movement/eu-rules_en",
      "title": "European Commission — EU rules for pet movement",
      "type": "OFICIAL",
      "lastAccessed": "2026-04-16"
    },
    {
      "url": "https://www.gov.br/agricultura/pt-br/assuntos/sanidade-animal-e-vegetal/saude-animal/transito-animal/exportacao/cao-e-gato",
      "title": "MAPA — Exportação de Cães e Gatos",
      "type": "OFICIAL",
      "lastAccessed": "2026-04-16"
    },
    {
      "url": "https://www.gov.br/agricultura/pt-br/assuntos/sanidade-animal-e-vegetal/saude-animal/transito-animal/exportacao/laboratorios-credenciados",
      "title": "MAPA — Laboratórios Credenciados para Sorologia",
      "type": "OFICIAL",
      "lastAccessed": "2026-04-16"
    },
    {
      "url": "https://food.ec.europa.eu/animals/live-animal-movements/dogs-cats-and-ferrets/bringing-pet-eu-non-eu-country_en",
      "title": "European Commission — Bringing a pet into the EU from a non-EU country",
      "type": "OFICIAL",
      "lastAccessed": "2026-07-17"
    },
    {
      "url": "https://food.ec.europa.eu/animals/live-animal-movements/dogs-cats-and-ferrets/travelling-pet-within-eu_en",
      "title": "European Commission — Travelling with pets within the EU",
      "type": "OFICIAL",
      "lastAccessed": "2026-07-17"
    }
  ],
  "changeLog": [
    {
      "date": "2026-04-16",
      "author": "Leonardo Braga de Almeida",
      "description": "Criação inicial com base no Regulamento (UE) n.º 576/2013 e normas MAPA vigentes"
    },
    {
      "date": "2026-07-17",
      "author": "Claude (pesquisa web automatizada) — revisão humana pendente: Leonardo Braga de Almeida",
      "description": "Revisão 2026-07-17 via fonte oficial (Comissão Europeia, fetch direto). Base legal: Reg. 576/2013 substituído em 22/04/2026 por Reg. Delegado (UE) 2026/131 + Reg. de Execução (UE) 2026/705. Exigências substantivas mantidas; AHC agora com validade 10 dias até entrada e 6 meses para circulação; 90 dias da sorologia contam antes da emissão do AHC; máx. 5 animais + declaração não-comercial. Confiança mantida ALTA."
    }
  ],
  "rules": {
    "exigeMicrochip": true,
    "microchipPadrao": "ISO 11784/11785 (transponder eletrônico 15 dígitos). Deve ser implantado ANTES da vacinação antirrábica para validade internacional.",
    "exigeVacina": true,
    "diasCarenciaVacina": 21,
    "validadeVacinaAnos": 1,
    "exigeSorologia": true,
    "diasCarenciaSorologia": 90,
    "valorMinimoSorologia": "≥0,5 UI/mL",
    "laboratoriosCredenciados": "Lista disponível em: https://www.gov.br/agricultura/pt-br/assuntos/sanidade-animal-e-vegetal/saude-animal/transito-animal/exportacao/laboratorios-credenciados",
    "exigeCVI": true,
    "diasAntesCVI": 10,
    "emissoresCVI": "AHC (Animal Health Certificate) conforme Anexo III do Reg. de Execução (UE) 2026/705, emitido por médico veterinário credenciado pelo MAPA e endossado pela SFA do estado de origem. Validade: 10 dias da emissão até os controles documentais/de identidade no ponto de entrada (+duração de viagem marítima, se aplicável); 6 meses para circulação subsequente dentro da UE.",
    "exigePermissaoImportacao": false,
    "racasRestritasOuProibidas": [],
    "observacoes": "Sequência obrigatória: (1) Microchip ISO 11784/11785 (antes da vacina) → (2) Vacina antirrábica (animal ≥12 semanas; validade a partir de 21 dias do protocolo primário) → (3) Sorologia RNATT ≥0,5 UI/mL em laboratório autorizado (coleta ≥30 dias após a vacina; resultado documentado ≥90 dias antes da EMISSÃO do AHC) → (4) AHC emitido até 10 dias antes da chegada. Entrada obrigatória por ponto de entrada de viajantes designado pelo país. Máximo 5 animais por responsável + declaração escrita de movimento não-comercial (Anexo V Parte 1, Reg. 2026/705). Cães com destino a Finlândia, Irlanda, Malta e Irlanda do Norte (e Noruega): tratamento contra Echinococcus multilocularis (praziquantel) entre 24h e 120h antes da entrada. Base legal desde 22/04/2026: Reg. Delegado (UE) 2026/131 + Reg. de Execução (UE) 2026/705, sob a Lei de Saúde Animal (Reg. 2016/429) — substituem o Reg. 576/2013 com exigências substantivas mantidas.",
    "observacoesInternas": "Revisado 2026-07-17 contra páginas oficiais da Comissão Europeia (fetch direto). MUDANÇA DE BASE LEGAL em 22/04/2026 (576/2013 → 2026/131 + 2026/705): sem mudança substantiva de requisitos, mas TODA menção a 576/2013 no app/site deve ser atualizada. Nuance nova: os 90 dias da sorologia contam antes da EMISSÃO do AHC (antes: antes da viagem). Reino Unido fora (Brexit) — arquivo próprio. Novos: declaração não-comercial obrigatória + limite 5 animais reforçado. Verificar na próxima revisão se pontos de entrada designados por país-membro afetam aeroportos de conexão comuns (CDG, FRA, LIS, MAD)."
  }
}